{
  "schemaVersion": "durable-progress.v1",
  "progressId": "progress-md-remapped",
  "sourceId": "contract-markdown",
  "readalongManifestId": "ram-md-002",
  "sourceRevisionId": "sr-md-002",
  "audioArtifactId": "audio-md-checked",
  "kind": "resume",
  "state": "remapped",
  "updatedAt": "2026-05-17T01:13:41Z",
  "canonical": true,
  "locatorEnvelope": {
    "schemaVersion": "locator-envelope.v1",
    "kind": "resume",
    "sourceId": "contract-markdown",
    "nodeId": "md-0001",
    "scopeKey": "document",
    "activeWordIndex": 1,
    "locator": {
      "type": "markdown",
      "markdown": {
        "path": "contract.md",
        "lineStart": 3,
        "lineEnd": 3,
        "columnStart": 1,
        "columnEnd": 28,
        "astPath": "/children/1"
      }
    },
    "textQuote": "Doctor Nguyen shipped version one."
  },
  "position": {
    "unitId": "unit-md-0001",
    "segmentId": "seg-0001",
    "activeWordIndex": 1,
    "audioOffsetMs": 280,
    "textQuote": "Doctor Nguyen shipped version one."
  }
}
